<?xml version="1.0" encoding="UTF-8" ?>
<rows xmlns:xsi="http://www.w3.org/2001/XMLSchema-instance"
    xsi:noNamespaceSchemaLocation="../schema/COURSES.xsd">
    <ROW>

        <DEPT_CODE>TST2</DEPT_CODE>
        <COURSE_NBR>2010</COURSE_NBR>
        <SECTION_NBR>001</SECTION_NBR>
        <CLASS_TYPE>LAB</CLASS_TYPE>
        <COURSE_TITLE>INQ MATH &amp; SCI TEACH</COURSE_TITLE>
        <GRADE_SYSTEM_CODE>L</GRADE_SYSTEM_CODE>
    </ROW>
    <ROW>
        <CAMPUS_CODE>01</CAMPUS_CODE>
        <DEPT_CODE>Biology</DEPT_CODE>
        <COURSE_NBR>101c</COURSE_NBR>
        <SECTION_NBR>001</SECTION_NBR>
        <CLASS_TYPE>LEC</CLASS_TYPE>
        <COURSE_TITLE>Intro to Organic Darwinism</COURSE_TITLE>
        <GRADE_SYSTEM_CODE>L</GRADE_SYSTEM_CODE>
    </ROW>
</rows>
